{
  "schema_version": "1.0.0",
  "account_id": "0xF39Fd6e51aad88F6F4ce6aB8827279cffFb92266",
  "migration_type": "GRACEFUL_HANDOVER",
  "old_node_id": "0x70997970C51812dc3A010C7d01b50e0d17dc79C8",
  "new_node_id": "0x3C44CdDdB6a900fa2b585dd299e03d12FA4293BC",
  "new_tpm_attestation": {
    "blinded_silicon_commitment": "0x26ba96e1aa79e34fdb6821620b72ecb2e1d716f649a0cc7ce2aa8553ca9ca743",
    "platform_pcr_digest": "0x223344556677889900aabbccddeeff11223344556677889900aabbccddeeff22",
    "ak_quote": "0x7a8b9c0d1e2f3a4b5c6d7e8f"
  },
  "zeroization_proof": {
    "zeroization_type": "TPM2_CLEARCONTROL",
    "proof_signature": "0x1234567890abcdef1234567890abcdef"
  },
  "handover_signatures": {
    "old_node_signature": "0x6d83b92783856faefc377dbad97a82c4f107384dbbfd01372ec0b4ecbe8855633b3b27b9c9f7a78120b60580daef1897d287bb12269a9b6c00325b74c0b4cb101b",
    "new_node_signature": "0x7e83b92783856faefc377dbad97a82c4f107384dbbfd01372ec0b4ecbe8855633b3b27b9c9f7a78120b60580daef1897d287bb12269a9b6c00325b74c0b4cb101c"
  },
  "challenge_timelock_deadline": 1741904800,
  "timestamp": 1741300000
}
